{
  "$schema": "https://json-schema.org/draft/2020-12/schema",
  "$comment": "Generated by scripts/export_api_schemas.py from apps/api/schemas.py: do not edit",
  "$defs": {
    "ComponentCheck": {
      "additionalProperties": false,
      "properties": {
        "component": {
          "enum": [
            "database",
            "scores",
            "models",
            "vllm",
            "demo_cache",
            "telemetry"
          ],
          "title": "Component",
          "type": "string"
        },
        "status": {
          "enum": [
            "ok",
            "unavailable",
            "disabled"
          ],
          "title": "Status",
          "type": "string"
        },
        "detail": {
          "anyOf": [
            {
              "maxLength": 300,
              "minLength": 1,
              "type": "string"
            },
            {
              "type": "null"
            }
          ],
          "title": "Detail"
        }
      },
      "required": [
        "component",
        "status",
        "detail"
      ],
      "title": "ComponentCheck",
      "type": "object"
    }
  },
  "additionalProperties": false,
  "properties": {
    "status": {
      "enum": [
        "ready",
        "degraded",
        "not_ready"
      ],
      "title": "Status",
      "type": "string"
    },
    "mode": {
      "enum": [
        "live",
        "cached"
      ],
      "title": "Mode",
      "type": "string"
    },
    "llm_mode": {
      "enum": [
        "vllm",
        "mock"
      ],
      "title": "Llm Mode",
      "type": "string"
    },
    "device": {
      "enum": [
        "cpu",
        "gpu"
      ],
      "title": "Device",
      "type": "string"
    },
    "label": {
      "anyOf": [
        {
          "const": "Precomputed on AMD MI300X",
          "type": "string"
        },
        {
          "type": "null"
        }
      ],
      "title": "Label"
    },
    "checks": {
      "items": {
        "$ref": "#/$defs/ComponentCheck"
      },
      "minItems": 1,
      "title": "Checks",
      "type": "array"
    },
    "contract_version": {
      "maxLength": 64,
      "minLength": 1,
      "title": "Contract Version",
      "type": "string"
    },
    "rules_version": {
      "maxLength": 64,
      "minLength": 1,
      "title": "Rules Version",
      "type": "string"
    },
    "assumptions_version": {
      "maxLength": 64,
      "minLength": 1,
      "title": "Assumptions Version",
      "type": "string"
    },
    "model_versions": {
      "additionalProperties": {
        "maxLength": 64,
        "minLength": 1,
        "type": "string"
      },
      "title": "Model Versions",
      "type": "object"
    }
  },
  "required": [
    "status",
    "mode",
    "llm_mode",
    "device",
    "label",
    "checks",
    "contract_version",
    "rules_version",
    "assumptions_version",
    "model_versions"
  ],
  "title": "ReadyzResponse",
  "type": "object"
}
