{
  "status": "ready",
  "mode": "live",
  "llm_mode": "vllm",
  "device": "gpu",
  "label": null,
  "checks": [
    {
      "component": "database",
      "status": "ok",
      "detail": null
    },
    {
      "component": "scores",
      "status": "ok",
      "detail": null
    },
    {
      "component": "models",
      "status": "ok",
      "detail": null
    },
    {
      "component": "vllm",
      "status": "ok",
      "detail": null
    },
    {
      "component": "demo_cache",
      "status": "disabled",
      "detail": null
    },
    {
      "component": "telemetry",
      "status": "ok",
      "detail": null
    }
  ],
  "contract_version": "1.1.0",
  "rules_version": "policy-2026-10-12",
  "assumptions_version": "assumptions-v1",
  "model_versions": {
    "risk": "risk-xgb-0.1.0",
    "propensity": "propensity-xgb-0.1.0",
    "graph": "graph-0.1.0",
    "evidence": "evidence-0.1.0",
    "value": "value-0.1.0"
  }
}
